"","date","year","headline"
"203",2020-10-23,2020,"Toronto police announce ‘neighbourhood teams’ in new gun violence plan, conceding years of major gang sweeps have been ineffective"
"204",2020-10-23,2020,"Pressure mounts on Air Canada to match WestJet’s refund policy on COVID-cancelled flights"
"206",2020-10-23,2020,"‘Refreshing respite from the childlike shouting match.’ What U.S. media are saying about the last presidential debate"
"207",2020-10-23,2020,"Trump and Biden’s final debate is calmer amid the campaign storm"
"208",2020-10-23,2020,"Today’s coronavirus news: Ontario reporting 826 new cases, 9 deaths; Sunnybrook declares outbreak; Le Chateau says it will go out of business, closing 123 stores"
"209",2020-10-23,2020,"‘It’s a racist system’: Some couples say Canada’s visa system is cruelly extending their COVID-19 separations"
"210",2020-10-24,2020,"Active open spaces, homes near work, walkable neighbourhoods — has COVID-19 changed the way the suburbs will look in the future?"
"211",2020-10-24,2020,"Here’s what you need to know from this week’s COVID-19 vaccine news: Testing milestones, presidential boasts and a Canadian hope"
"212",2020-10-24,2020,"‘Dramatic’ decline in Canadians who say discrimination against Black and Chinese communities is not a problem here"
"213",2020-10-24,2020,"‘I waver between awe and sadness.’ How 12 Nigerian-Canadians feel about the #EndSARS uprising and what they would like the rest of Canada to know"
"214",2020-10-24,2020,"After thumbing his nose at China, Prague’s mayor has this advice for Canada. ‘Their power is overrated’"
"215",2020-10-24,2020,"Bob Hepburn: Needy kids face a bleak Christmas and need your help. Join Raptors Superfan Nav Bhatia and hundreds of others in The Star’s Santa Claus Fund"
"216",2020-10-24,2020,"Today’s coronavirus news: Ontario reports 978 cases, a record-high 7-day avg.; U.S. sets infection record; Poland’s president tests positive for COVID-19; India’s overall case tally moves past 7.8M"
"217",2020-10-24,2020,"Ontario shut down non-urgent health services in the spring. Now hospitals are seeing many more patients with advanced cancers"
"218",2020-10-25,2020,"This cancer survivor was harassed, taunted and sprayed with Lysol by colleagues. But a tribunal says she can’t sue her workplace"
"219",2020-10-25,2020,"What superspreader events like the one at Hamilton’s SpinCo can tell us about the way forward in the pandemic"
"220",2020-10-25,2020,"Looking to rent in Toronto? Now is the time — rents are down by more than 16% in some neighbourhoods"
"221",2020-10-25,2020,"‘I waver between awe and sadness.’ How 12 Nigerian-Canadians feel about the #EndSARS uprising against police brutality and what they want you to know"
"222",2020-10-25,2020,"Shoppers Drug Mart has become a huge pandemic winner — and it didn’t happen by accident"
"223",2020-10-25,2020,"COVID-19 has turned the restaurant industry upside down. Is it time to rethink regulations around home food businesses?"
"224",2020-10-25,2020,"Today’s coronavirus news: Ontario reports 1,042 cases, case average hits another record high; Quebec reports 879 new cases in the past 24 hours, bringing pandemic total to 100,114"
"225",2020-10-25,2020,"Mental illness is on the rise due to COVID-19. Could psychedelic drugs be the ‘game changer’?"
"226",2020-10-26,2020,"‘Massive blunder’: TTC union turned down a deal in the benefits fraud scheme that could have saved money and jobs. Now everyone is paying the price"
"227",2020-10-26,2020,"Canadians’ attitudes toward police — ‘True Blue’ versus ‘Defunders’ — split along regional, political lines, survey reveals"
"228",2020-10-26,2020,"Democrats ask Pence to skip Barrett vote over COVID-19 risk"
"229",2020-10-26,2020,"This RCMP corporal has been on medical leave for 17 years. Could an end to his messy dispute with the force be near?"
"231",2020-10-26,2020,"Experts point to ‘crucial’ week ahead after Ontario reports more than 1,000 infections on Sunday, a new all-time high"
"232",2020-10-26,2020,"Today’s coronavirus news: Parliamentary probe examining Trudeau’s handling of the pandemic could be approved; Tougher COVID-19 restrictions expected for Halton and Durham regions"
"234",2020-10-27,2020,"‘I want to stay here. This is my home’: Parkdale tenants fear huge new ‘campus of care’ will uproot their cherished community"
"235",2020-10-27,2020,"Video campaign shows how much Black history is taught in Ontario schools. Not much"
"236",2020-10-27,2020,"Hospitals full as cases surge in province’s ‘hot spots’: These 3 charts show where Ontario is right now in the COVID-19 battle"
"237",2020-10-27,2020,"After record number of COVID-19 cases, Ontario’s numbers take a slight drop"
"238",2020-10-27,2020,"Liberals defend Fortress Toronto despite surprise nail-biter with Conservatives in York Centre and strong showing from Green Leader Annamie Paul in Toronto Centre"
"239",2020-10-27,2020,"2020 U.S. election roundup for Oct. 27: Joe Biden and Donald Trump hit battleground states with a week left"
"240",2020-10-27,2020,"Today’s coronavirus news: Ontario reporting 827 cases, 4 deaths; COVID Alert app is up to 4.8M downloads in Canada; New Brunswick reporting 3 new cases"
"241",2020-10-27,2020,"COVID-19 cases jump by 144 in Ontario public schools, including 82 more students, in latest report"
"242",2020-10-28,2020,"Through impeachment, scandals and COVID-19, Biden has held his lead over Trump since January"
"243",2020-10-28,2020,"Almost two months into the school year, here’s what we know — and don’t — about school safety in the pandemic"
"244",2020-10-28,2020,"A tale of two COVID quarantines: My strict lockdown experience in Thailand versus a relaxed approach in Canada"
"245",2020-10-28,2020,"North York industrial bakery used temp agencies to make millions in false tax deductions, Canada Revenue Agency says"
"246",2020-10-28,2020,"Bank of Canada holds rate steady, says COVID-19 economic recovery likely by 2022"
"247",2020-10-28,2020,"Raptors’ Terence Davis arrested in New York after allegedly assaulting girlfriend"
"248",2020-10-28,2020,"Today’s coronavirus news: Ontario reporting 834 cases, 5 deaths; Bank of Canada holds rate steady, says COVID-19 economic recovery likely by 2022"
"249",2020-10-28,2020,"Total COVID-19 cases surpass 2,000 in Ontario public schools since beginning of September"
"250",2020-10-29,2020,"Man sentenced to 13 years for daylight attack that left two young girls shot at Scarborough playground"
"251",2020-10-29,2020,"COVID-19 forced Toronto's $2.2B film and TV production industry to a grinding halt. With 23 projects now underway, insiders say it’s a strong comeback"
"252",2020-10-29,2020,"Parents of 2-year-old boy found overnight in just a diaper and T-shirt have been located, Toronto police say"
"253",2020-10-29,2020,"44 positive COVID-19 cases linked to two-day wedding event in Vaughan"
"254",2020-10-29,2020,"France goes on maximum alert after attack at church kills 3"
"255",2020-10-29,2020,"Watchdog probes death of man shot and killed by police officers in Montreal"
"256",2020-10-29,2020,"Today’s coronavirus news: Ontario reporting 934 cases of COVID-19, 420 in Toronto which is a new daily record; Mask usage at 98 per cent on TTC, audit shows"
"257",2020-10-29,2020,"How will COVID-19 affect you? Your postal code matters as much as your genetic code, says Canada’s top doctor"
"259",2020-10-30,2020,"Why the time change just won’t die — yet"
"260",2020-10-30,2020,"Premier Doug Ford’s constituency office in Etobicoke North closed because of COVID-19 outbreak"
"261",2020-10-30,2020,"Most economic and business forecasts assume there will be an effective COVID-19 vaccine. But what if there isn’t?"
"262",2020-10-30,2020,"Ethics probe partially clears Bill Morneau, finds he ‘genuinely believed’ he had paid the $41,000 cost of two WE Charity trips"
"263",2020-10-30,2020,"How Jill Biden could be Joe Biden’s secret weapon in campaign to beat Donald Trump"
"264",2020-10-30,2020,"Waiting for Ivanka Trump in North Carolina, the toss-up state that could decide the election"
"265",2020-10-30,2020,"Immigration shortfalls from COVID-19 may spell short-term gain, but long-term pain for housing market"
"266",2020-10-30,2020,"Doug Ford promises ‘surgical’ approach to COVID-19 restrictions as cases predicted to remain above 800 daily"
"267",2020-10-30,2020,"Today’s coronavirus news: Ontario reporting 896 cases, 9 deaths; Premier Ford’s constituency office in Etobicoke North closed due to COVID-19 outbreak"
"268",2020-10-31,2020,"These ‘citizens’ from Steve Bannon and a Chinese billionaire’s ‘federal state’ have been protesting in a Metro Vancouver cul-de-sac for nearly 50 days. What do they want?"
"269",2020-10-31,2020,"COVID-19 outbreak at Scarborough elementary school causes 58 students to self-isolate"
"270",2020-10-31,2020,"Donald Trump or Joe Biden, Canada is bracing for U.S. civil unrest"
"271",2020-10-31,2020,"‘RIP to that great man, that great actor’: World reacts to the passing of Scottish actor Sir Sean Connery"
"272",2020-10-31,2020,"Reviving basic income? Canadian Chamber of Commerce urges federal government to pick up Ontario’s cancelled pilot project"
"273",2020-10-31,2020,"Ford, Tory want to lift restrictions on restaurants, bars after 28 days, but epidemiologists warn this could have tragic consequences"
"274",2020-10-31,2020,"Today’s coronavirus news: Ontario reports 1,015 cases, 9 deaths; 11 cases at Scarborough school; situation among Indigenous on Prairies ‘alarming’"
"275",2020-10-31,2020,"Home for the holidays takes on new meaning as Ottawa says big parties are a no-go"
"276",2020-10-31,2020,"On November 1, Ontario is introducing a new electricity pricing plan — if you work from home, you might want to switch to it"
"277",2021-10-01,2021,"Toronto loses bid at Supreme Court of Canada to overturn Doug Ford’s cut to city council"
"278",2021-10-01,2021,"Toronto police charge Peter Nygard with sex assaults, forcible confinement spanning 19 years"
"279",2021-10-01,2021,"Nova Scotia is pausing referrals for medical-assistance-in-dying amid increased demand and COVID strains"
"280",2021-10-01,2021,"New data shows downtown Toronto’s economic rebound lags behind GTA — and Canada overall"
"281",2021-10-01,2021,"‘The conduct of councillors is out of control’: Name-calling, bullying and squabbling at Richmond Hill council has brought city business to a standstill"
"282",2021-10-01,2021,"Lawyers for estate of Barry and Honey Sherman warned of ‘violence’ and ‘kidnapping’ if files made public, but unsealed documents show they had no evidence"
"283",2021-10-01,2021,"Culture, mentality, McNuggets: How Canada became a tennis powerhouse — and what happens next"
"284",2021-10-01,2021,"Today’s coronavirus news: Ontario reporting 1,315 new COVID-19 over the past two days; B.C.'s health officer to announce enhanced health and safety plan for schools;"
"285",2021-10-01,2021,"Are Canada’s sex work laws unconstitutional? Why that open question has thrown Ontario law enforcement into chaos"
"286",2021-10-01,2021,"Less than $330,000 for a bright studio condo in prime downtown Toronto? Go the co-ownership route"
"287",2021-10-01,2021,"Justin Trudeau flies to Tofino for family vacation as Canada marks first National Day for Truth and Reconciliation"
"288",2021-10-01,2021,"Brampton mayor says city officials have been ‘vindicated’ by report, but city director said probe is inadequate"
"289",2021-10-02,2021,"‘There are no winners here, only losers.’ The inside story of how the Green party toppled Annamie Paul and tore itself apart in the process"
"290",2021-10-02,2021,"The Saturday Debate: Should the Conservative Party keep Erin O’Toole as leader?"
"291",2021-10-02,2021,"The Two Michaels: Friends and relatives reveal how they coped behind bars — exercise, books, and determination ‘to not be broken’"
"292",2021-10-02,2021,"Nearly 10 years ago, the Star helped a teenager escape the Taliban. When militants took back Afghanistan, it was her turn to save her family"
"293",2021-10-02,2021,"Canadian university student charged with murdering three of his family members in Trinidad"
"295",2021-10-02,2021,"Election? What election? Many experts say federal vote a mere blip on Canada’s economic radar"
"296",2021-10-02,2021,"‘He’s my only best friend.’ Joey Votto’s greatest legacy might be the mark he’s made on his youngest fans"
"297",2021-10-02,2021,"Navneet Alang: As technology gives, so does it take away"
"298",2021-10-02,2021,"Today’s coronavirus news: Pfizer submits preliminary research on COVID-19 vaccine for kids aged five to 11; Ontario reports another 704 COVID-19cases and seven more deaths; Canadians overwhelmingly su"
"299",2021-10-03,2021,"Shrouded in secrecy, here is the inside story behind the two Michaels’ flight to freedom"
"300",2021-10-03,2021,"Elizabeth May: Annamie Paul told me to stay silent. But now I must say something"
"301",2021-10-03,2021,"She was pregnant and needed new lungs. In a world first, here’s how Toronto doctors saved a dying mom — and her baby"
"302",2021-10-03,2021,"Don’t say ‘Taliban’: Facebook suppresses Afghan activists and artists leading the resistance"
"303",2021-10-03,2021,"Doug Ford hits the reset button with throne speech"
"304",2021-10-03,2021,"Son of ‘black widow’ arrested in mysterious 2018 disappearance of Canadian snowbird"
"305",2021-10-03,2021,"‘Birth without a family’: Some babies born to unconscious moms in COVID-ravaged Alberta"
"306",2021-10-03,2021,"Today’s coronavirus news: Ontario reports 580 new cases; New Brunswick faces record surge in cases"
"307",2021-10-03,2021,"As temperatures drop, the battle between Delta and vaccines moves to a new arena: indoors"
"308",2021-10-03,2021,"How to ask your family about vaxxing and why you definitely should"
"309",2021-10-03,2021,"Classic Toronto home owners have been turning to the Door Store for nearly 50 years for vintage architectural pieces"
"310",2021-10-03,2021,"MAKECanada contest winners are creating clothes for a post-pandemic world"
"311",2021-10-03,2021,"How Brenton Mowforth uses Instagram to promote the city’s cocktail culture to the world"
"312",2021-10-04,2021,"Professional misconduct cases expose Ontario lawyers’ unease over ‘misleading’ advertising"
"313",2021-10-04,2021,"Premier Doug Ford touts Tory record of fighting COVID-19 in throne speech"
"314",2021-10-04,2021,"Ontario rent freeze expires on Jan. 1"
"315",2021-10-04,2021,"‘It’s going to be rough’: Small businesses fear looming end of wage and rent subsidies"
"316",2021-10-04,2021,"Facebook, Instagram and WhatsApp appear to be experiencing global outage. Here’s what people are saying"
"317",2021-10-04,2021,"Today’s coronavirus news: Ontario reports 511 new COVID-19 cases; Edmonton issues vaccine mandate for public school staff, teachers"
"318",2021-10-04,2021,"Meet Canada’s first openly Two-Spirit member of Parliament"
"319",2021-10-04,2021,"Billionaires, Olympian and porn king among Canadians named in massive new leak exposing offshore accounts and secret tax havens of the global elite"
"320",2021-10-04,2021,"While Canada sent hundreds of millions in aid to Jordan, its king grew his collection of luxury homes"
"321",2021-10-04,2021,"Opening the Pandora Papers and what they reveal"
"322",2021-10-04,2021,"‘Will we grow old separated like this?’ Tired of pandemic limbo, spouses have found a new way to fight Canada’s immigration backlog"
"324",2021-10-05,2021,"He can’t wait to be vaccinated for COVID-19 — but his preferred brand hasn’t been approved yet"
"325",2021-10-05,2021,"This man helped set up hundreds of offshore firms for rich clients. His case shows how Canada has ‘turned a blind eye’ to cracking down on offshore tax schemes"
"326",2021-10-05,2021,"New Zealand has ditched its ‘COVID-Zero’ strategy. Will proponents in Canada do the same?"
"327",2021-10-05,2021,"‘We are sorry’: Facebook apologizes and explains Monday’s global outage"
"328",2021-10-05,2021,"Toronto area home prices surge more than 18% to hit a new record high"
"329",2021-10-05,2021,"‘Earth-shattering’: Why applicants to Canada’s special, one-time immigration program fear a computer glitch may have dashed their dreams"
"330",2021-10-05,2021,"Online genealogy helping police zero in on killer of Erin Gilmour, Toronto magnate’s daughter"
"331",2021-10-05,2021,"Ontario to roll out rapid testing at schools, daycares in COVID-19 hot spots for unvaccinated students"
"332",2021-10-05,2021,"Today’s coronavirus news: Ontario reports 429 new cases; B.C. mandates vaccination for government employees; Canada’s gas use at lowest rate in 20 years due to lockdowns"
"333",2021-10-05,2021,"Steven Del Duca’s Liberals say attack ads from Premier Doug Ford are a badge of honour"
"334",2021-10-05,2021,"Toronto high school in lockdown after reports of a stabbing"
"335",2021-10-05,2021,"Statement: Canadian media united in support of journalists against online hate, threats and harassment"
"336",2021-10-06,2021,"Riders left the TTC in droves over COVID-19. Could that trigger a public transit ‘death spiral’?"
"337",2021-10-06,2021,"He was under investigation in Canada and the U.S. So how was this Montreal businessman able to set up a secret offshore company in one of the world’s most opaque tax havens?"
"338",2021-10-06,2021,"Toronto teacher found not guilty in drowning of Jeremiah Perry, 15, on Algonquin Park trip"
"339",2021-10-06,2021,"Vaccination mandate for federal employees comes into effect today"
"340",2021-10-06,2021,"Check vaccination status of Thanksgiving guests, urges Toronto’s top doctor"
"341",2021-10-06,2021,"Today’s coronavirus news: Ontario reporting 476 new COVID-19 cases; Canada makes vaccines mandatory for public servants, air and rail workers, travellers"
"342",2021-10-06,2021,"‘I regret it’: Justin Trudeau apologizes for vacationing on National Day for Truth and Reconciliation"
"343",2021-10-06,2021,"A streamlined process that gets you into your new home faster and cheaper? That’s the goal of new startup RIOS"
"344",2021-10-06,2021,"Manufacturers, warehouses are the leading source of COVID-19 outbreaks outside schools — but many still don’t require that workers get vaccinated"
"345",2021-10-06,2021,"York school board staff objected to controversial hybrid learning model, but senior leaders pushed ahead anyway: Sources"
"346",2021-10-06,2021,"World's first malaria vaccine set to be deployed after backing from WHO"
"347",2021-10-06,2021,"Senior military officer who wrote positive letter for soldier guilty of sexual assault removed from sexual misconduct job"
"348",2021-10-06,2021,"Embattled parents seek transparency in alleged tunnel vision case involving Ontario’s top pathologist"
"349",2021-10-07,2021,"This Lebanese-Canadian’s offshore company is accused of shipping mortar shells that have fallen into the hands of ISIS"
"350",2021-10-07,2021,"Toronto is recording second-lowest COVID vaccination rates among those over 80 in Ontario"
"351",2021-10-07,2021,"New report lays out grim toll on Afghan women and girls after less than two months of Taliban rule"
"352",2021-10-07,2021,"Toronto’s gridlock is already back — and your commute may get worse than ever after COVID-19"
"353",2021-10-07,2021,"‘Markets going haywire’: Toronto residents can expect a hike in heating bill, fuel costs as global energy system struggles"
"355",2021-10-07,2021,"Live at noon: Questions about the Pandora Papers? Join Star investigative reporter Robert Cribb for a live chat"
"356",2021-10-07,2021,"Today’s coronavirus news: Ontario's top doctor to release guidance for Thanksgiving, Halloween; Pfizer asks U.S. to allow COVID shots for kids 5 to 11"
"357",2021-10-07,2021,"Top public pension boss accused by critic of misleading stakeholders in annual address"
"358",2021-10-07,2021,"Judge orders Texas to suspend new law banning most abortions"
"359",2021-10-08,2021,"In a county with one of Alberta’s lowest vaccination rates, faith and freedom divide a Mennonite community"
"360",2021-10-08,2021,"When the pandemic hit, Indigo’s online sales more than doubled. Could the forced shutdown hold the key to saving Canada’s bookstore?"
"361",2021-10-08,2021,"Horwath’s New Democrats launch campaign ad blitz"
"362",2021-10-08,2021,"The Canadian men make a point in Azteca, and they could have come away with more against Mexico"
"363",2021-10-08,2021,"‘Pure energy and hustle.’ Scottie Barnes has infused Raptors with a youthful exuberance and his teammates love it"
"364",2021-10-08,2021,"The hugely controversial Highway 413 will cost taxpayers billions. But just how much the province won’t say"
"365",2021-10-08,2021,"Think Ontario needs Hwy. 413? Then vote for me, Doug Ford says in new ads"
"366",2021-10-08,2021,"Today’s coronavirus news: Ontario reports 573 new cases; Canada adds 157,000 jobs in September, returns to pre-pandemic levels"
"367",2021-10-09,2021,"Althia Raj: The Star talked to 57 insiders. Here’s what we learned about how Justin Trudeau turned around his faltering campaign and defeated Erin O’Toole"
"368",2021-10-09,2021,"The true cost of a COVID-19 test is less than $100 — so why are labs allowed to charge us as much as $395 per test?"
"369",2021-10-09,2021,"One parent wants a child vaccinated against COVID-19, but the other does not. How does a family court judge decide what to do?"
"370",2021-10-09,2021,"Shawn Micallef: City council showed its contempt for Toronto renters during the debate over rooming houses. Its inaction in a housing crisis is both insulting and cowardly"
"371",2021-10-09,2021,"Ottawa stuns telecoms with surprise announcement that Canadians living near airports won’t get full 5G service"
"372",2021-10-09,2021,"The Saturday Debate: Has Canada’s relationship with China become too damaged?"
"373",2021-10-09,2021,"There were almost no flu cases in Canada last year. Will that make this year’s season more deadly?"
"374",2021-10-09,2021,"Were there more storms this summer or are we just getting better at taking pictures of them? We asked the experts"
"375",2021-10-09,2021,"Navneet Alang: The answers to what we can do about Facebook are hard and unclear. But we must be willing to imagine something different"
"376",2021-10-09,2021,"As families approach Thanksgiving with fewer restrictions, they’re also balancing risk — and thorny conversations"
"377",2021-10-09,2021,"Cases on gradual rise as Ontario loosens some gathering restrictions"
"378",2021-10-09,2021,"Heather Scoffield: Canada must be careful about clawing back CRB and other pandemic benefits"
"379",2021-10-09,2021,"Today’s coronavirus news: Ontario reports 654 new cases of COVID-19 Saturday; capacity limits lift in Ontario cinemas, spectator sports venues, other spaces"
"380",2021-10-10,2021,"Eyes turn to Ottawa as sexual misconduct crisis continues to rock the Canadian Armed Forces"
"381",2021-10-10,2021,"For Joe Biden, a tense few hours has turned into a bitter few weeks"
"382",2021-10-10,2021,"New Democrats didn't break through in the federal election. Now they need to figure out why"
"384",2021-10-10,2021,"One parent wants a child vaccinated against COVID. The other does not. How does a judge decide what to do?"
"385",2021-10-10,2021,"Althia Raj: Althia Raj talked to 57 insiders. Here’s what she learned about how Justin Trudeau pulled Erin O’Toole back from the brink of power"
"386",2021-10-10,2021,"Today’s coronavirus news: B.C. lets kids under 12 register for vaccines; 535 new COVID-19 cases reported in Ontario"
"387",2021-10-10,2021,"Steven Truscott’s wrongful conviction for rape and murder was a miscarriage of justice. So who did kill Lynne Harper?"
"388",2021-10-10,2021,"Navy nuclear engineer charged with trying to pass secrets"
"389",2021-10-10,2021,"Shooting at Thorncliffe Park leaves two seriously injured"
"390",2021-10-10,2021,"Pilot dead, others injured after two separate small plane crashes in central Alberta"
"391",2021-10-10,2021,"How one couple’s connection to the city led to a one-of-a-kind wedding"
"392",2021-10-10,2021,"From ghost tours to haunted houses, here's how to get your Halloween on in Toronto this week"
"393",2021-10-10,2021,"How Mary Commanda weaves dreamcatchers — and connections — from her studio, Sticks and Bones"
"394",2021-10-11,2021,"Here’s how this eastern Ontario health unit hit a provincial vaccination high of 92 per cent"
"395",2021-10-11,2021,"They saw prayers, the court saw contempt: As Indigenous protesters cite their duty to protect the land, will Canada’s judges listen?"
"397",2021-10-11,2021,"Adamson Barbecue owner says he’s shutting down all three locations over vaccine passport rules"
"398",2021-10-11,2021,"The key to a good Halloween is to make safe choices this Thanksgiving: experts"
"399",2021-10-11,2021,"Today’s coronavirus news: Merck applies for emergency approval of promising anti-COVID pill; Boston Marathon returns for the first time since the pandemic began"
"400",2021-10-11,2021,"Self-taught artist whose work has been compared to the late Basquiat looks forward to first show in Toronto"
"401",2021-10-11,2021,"Kathy Sutton’s father’s legacy in stone was hidden behind bars for years at Exhibition Place. That’s about to change"
"402",2021-10-11,2021,"Why does the success of ‘Squid Game’ and Korean pop culture continue to surprise people?"
"403",2021-10-11,2021,"Canadian David Card is among the three US-based economists awarded the Nobel Prize for economics"
"404",2021-10-11,2021,"Carlos makes $43,000 as a hospital cleaner in Toronto. He’s about to come into a large inheritance. How should he use it?"
