"","date","year","headline"
"1",2020-10-01,2020,"Seth MacLean was one of nine fatal overdoses in Toronto shelters in July — during one of the system’s deadliest summers. His family wants changes made so it can’t happen again"
"2",2020-10-01,2020,"Memo reveals ‘shocking’ police misuse of COVID-19 database, say rights groups"
"3",2020-10-01,2020,"Relations between Canada and China are strained. So what happens if China gets a COVID-19 vaccine first?"
"4",2020-10-01,2020,"Indigenous woman who endured racist slurs as she lay dying prompts calls for action from Ottawa"
"5",2020-10-01,2020,"Did Trump display textbook signs of authoritarianism during the debate? Here’s what the experts say"
"6",2020-10-01,2020,"Will Donald Trump’s shout-out to the Proud Boys be a ‘call to action’ in Canada?"
"7",2020-10-01,2020,"Today’s coronavirus news: Some Ontario in-school vaccination programs moved to clinics; Partial lockdown measures begin in 3 Quebec regions; Nearly half of Peel students are learning online"
"8",2020-10-01,2020,"Canada has approved a 15-minute COVID test. But the lineups will still go on for hours"
"9",2020-10-01,2020,"Stuck in lockdown limbo? Here’s what to expect in the second wave"
"10",2020-10-01,2020,"Canada’s economy to take a hit from the second wave, economist says — and some sectors may never recover"
"11",2020-10-02,2020,"Trump shows ‘mild symptoms’ of COVID-19 after positive test for president, first lady"
"12",2020-10-02,2020,"Around the world reaction as Donald and Melania Trump test positive for COVID-19"
"13",2020-10-02,2020,"Fleeing Trump’s America for Canada? This New Yorker did it. Now he’s helping others follow"
"14",2020-10-02,2020,"Melania Trump takes aim at migrant children, critics in profane rant"
"15",2020-10-02,2020,"Ontario students with the sniffles no longer need a COVID test. Some experts warn this might be a big mistake"
"16",2020-10-02,2020,"Today’s coronavirus news: Ontario sets new record with 732 reported cases; Trump, first lady test positive for virus; Biden tests negative"
"17",2020-10-02,2020,"Ontario sets second record this week for COVID-19 cases with 732 new infections"
"18",2020-10-02,2020,"Under COVID-19, work-at-home has hollowed out Toronto’s core. Will it ever spring back to life?"
"19",2020-10-02,2020,"Toronto officials push province for new restrictions as rate of new COVID-19 infections soars to highest ever"
"20",2020-10-02,2020,"Ontario reports 30 more students with COVID-19 in latest daily report"
"21",2020-10-02,2020,"‘We’re inspired’: Jordan Bitove becomes Toronto Star publisher and Paul Rivett takes over as chair of Torstar"
"22",2020-10-02,2020,"SickKids is about to cover the GTA with giant beads. The message behind the movement is empowering"
"23",2020-10-03,2020,"Here are 8 implications of Donald Trump’s COVID-19 diagnosis"
"24",2020-10-03,2020,"Toronto’s chief medical officer is begging people stay home. This interactive map shows where gathering in groups poses the greatest risk"
"25",2020-10-03,2020,"Today’s coronavirus news: New public health measures in effect in Ontario’s COVID-19 hot spots; Madrid starts partial virus lockdown; India's fatalities top 100,000, behind US, Brazil"
"26",2020-10-03,2020,"13 of the week’s best long reads from the Star, Sept. 26 to Oct. 2, 2020"
"27",2020-10-03,2020,"How the worlds of Schitt’s Creek, Jamal Murray and the future of Canadian basketball collided at the Rosebud Motel"
"28",2020-10-03,2020,"Who's the boss? Not the next leader of the Green party, says Elizabeth May"
"29",2020-10-04,2020,"‘Robbing Peter to pay Paul’: An analysis shows Ontario’s trumpeted $1.3B back-to-school plan is all about muddy math"
"30",2020-10-04,2020,"Today’s coronavirus news: Ontario reporting 566 cases, including 196 in Toronto; 17 more COVID-19 patients hospitalized in Toronto"
"31",2020-10-04,2020,"Toronto Public Health to stop tracing close contacts of COVID cases in the community as infections soar"
"32",2020-10-04,2020,"‘It’s life and death’: As Ontario hospitals face new wave of COVID-19, disability advocates want triage protocol released"
"33",2020-10-04,2020,"Toronto lawyer Annamie Paul elected Green Party of Canada leader"
"34",2020-10-04,2020,"Toronto’s chief medical officer is begging people to stay home. This interactive map shows where gathering in groups poses the greatest risk"
"35",2020-10-04,2020,"With conflicting reports of how Donald Trump is coping with COVID, knowing the truth may be tricky"
"36",2020-10-04,2020,"Trump said to be improving but next 48 hours ‘critical’"
"37",2020-10-05,2020,"Coalition calls for national action plan on white supremacist groups in wake of Zafis murder outside Rexdale mosque"
"38",2020-10-05,2020,"Ontario teachers say they’re ‘June tired,’ but it’s only October. Such is the toll of COVID-19"
"39",2020-10-05,2020,"Trump aims for Monday release after outside drive-by"
"40",2020-10-05,2020,"New COVID-19 cases in Ontario public schools jump by 56 in latest provincial data"
"41",2020-10-05,2020,"Barry and Honey Sherman estate case to test Canada’s open court tradition in Supreme Court of Canada hearing"
"42",2020-10-05,2020,"The Sherman Estate and the Supreme Court"
"43",2020-10-05,2020,"Today’s coronavirus news: Ontario reporting 615 new cases; Trump’s press secretary tests positive for coronavirus; WHO says 10% of world's people may have been infected"
"44",2020-10-05,2020,"Most Ontarians favour small Thanksgiving gatherings and oppose trick-or-treating due to COVID-19, poll says"
"45",2020-10-06,2020,"‘We don’t have any say.’ For TDSB’s adult learners chaotic planning and a lack of online options threatens to halt their education"
"46",2020-10-06,2020,"Ontario ombudsman blasts ‘outdated’ police training tool that emphasizes weapons over de-escalation, despite repeated calls for change"
"47",2020-10-06,2020,"Negative views of China reach historic highs in Canada amid COVID-19 outbreak"
"48",2020-10-06,2020,"COVID-19 brought sweeping changes to the court system. But the jury’s still out on whether it can weather a second wave"
"49",2020-10-06,2020,"More than 10 per cent of COVID-19 tests are coming back positive in some pockets of Toronto"
"50",2020-10-06,2020,"GTA home sales and prices see double digit September gains"
"51",2020-10-06,2020,"Today’s coronavirus news: Ontario reporting 548 cases of COVID-19, 7 new deaths as appointment-based testing begins; Canadians divided on whether to let pandemic disrupt Halloween, poll says"
"52",2020-10-06,2020,"Ontario COVID-19 assessment centres move to an appointment-only system. Here’s how to get a booking in the GTA"
"53",2020-10-06,2020,"Ontario scraps social circles as COVID-19 cases continue to surge"
"54",2020-10-06,2020,"As he leaves hospital, Donald Trump says there’s nothing to fear from COVID-19. That’s something to be afraid of"
"55",2020-10-06,2020,"Steven Del Duca urges Premier Doug Ford to close indoor restaurants, bars and gyms for 28 days to curb COVID-19 spread"
"56",2020-10-07,2020,"‘We all keep each other accountable’: How university roommates have handled COVID-19 precautions as Thanksgiving looms"
"57",2020-10-07,2020,"Ontario reports 23.6% jump from previous day in school-related COVID-19 cases, with 69 more students in latest data"
"58",2020-10-07,2020,"Hundreds of teachers to be switched from in-person to virtual school as TDSB announces huge reorganization"
"59",2020-10-07,2020,"Ontario will make takeout booze sales permanent to help pandemic-ravaged restaurants and bars"
"60",2020-10-07,2020,"Pence-Harris debate to unfold as Trump recovers from virus"
"61",2020-10-07,2020,"Toronto’s top doctor wants restaurants to close — Doug Ford wants them open. Health experts say those mixed messages could result in more cases"
"64",2020-10-07,2020,"Today’s coronavirus news: Ontario reporting 583 new cases of COVID-19; Indebted Canadian businesses more ‘fragile’ than during 1st wave, economist says"
"65",2020-10-08,2020,"Canada is preparing for possible ‘disruptions’ following U.S. election, Justin Trudeau says"
"66",2020-10-08,2020,"Ontario sets new one-day record with 797 more COVID-19 cases"
"67",2020-10-08,2020,"Is anyone taking the second wave of COVID-19 seriously? This data shows we’re shopping and travelling like it’s practically 2019"
"68",2020-10-08,2020,"Ontario reports 100 more school-related COVID-19 cases, with 51 among students"
"69",2020-10-08,2020,"Six charged in plot to kidnap Michigan Gov. Gretchen Whitmer"
"70",2020-10-08,2020,"Today’s coronavirus news: COVID-19 numbers continue to surge in Ontario and Quebec ahead of Thanksgiving weekend"
"71",2020-10-08,2020,"It’s hard for Canadians with disabilities to get work. Ottawa is working on a plan to help"
"72",2020-10-08,2020,"Trump, Biden teams debate next debate: Next week? Never?"
"73",2020-10-09,2020,"Ontario to ban indoor dining, close gyms and lower gathering limits as new COVID-19 cases hit a record 939"
"74",2020-10-09,2020,"Ontario’s COVID-19 testing system in upheaval as volumes drop at some sites, positivity rates rise and samples get shipped out of province"
"75",2020-10-09,2020,"Fearing second COVID-19 wave in Toronto, Green Leader Annamie Paul calls on Justin Trudeau to suspend byelections in the city"
"76",2020-10-09,2020,"How risky is a get together in Toronto right now? In some scenarios, there's a 25% chance COVID-19 will be a guest at the party"
"77",2020-10-09,2020,"Everyone is getting everything delivered these days. But that can cause chaos on city streets, and Toronto officials are trying to change that"
"78",2020-10-09,2020,"COVID-19 pushes ballet school, students into new creative realms"
"79",2020-10-09,2020,"Today’s coronavirus news: Ontario banning indoor dining, closing gyms, theatres for 28 days; Ontario announces record-high 939 cases"
"80",2020-10-09,2020,"NHL free agency: Maple Leafs sign Wayne Simmonds"
"81",2020-10-09,2020,"Toronto suspends many indoor recreation, sports programs as COVID-19 second wave grows"
"82",2020-10-09,2020,"Stick a fork in it, Thanksgiving is done: An epidemiologist’s guide to the upcoming holidays"
"83",2020-10-09,2020,"‘Is this the best route?’: East York homeowners get early warning their property is needed for the $11B Ontario Line"
"84",2020-10-10,2020,"He lost his wife. Now this man is fighting for supports during the pandemic that she did not receive"
"85",2020-10-10,2020,"Boys’ club on Bay Street? Former RBC employee speaks out against a culture of sexism and silence"
"86",2020-10-10,2020,"Bruce Arthur: Premier Doug Ford and his medical officer of health were shocked by rising COVID numbers. Let that sink in"
"87",2020-10-10,2020,"Boaters who live year-round in a Queen’s Quay marina are getting tossed due to COVID-19. Harbourfront’s abrupt move has left some high and dry for the winter"
"88",2020-10-10,2020,"Contact tracing is a key to battling COVID-19. If we stop, shutting down is inevitable, experts say"
"89",2020-10-10,2020,"Toronto, Peel and Ottawa have new COVID-19 restrictions. Here’s what you can and can’t do now"
"90",2020-10-10,2020,"Today’s coronavirus news: Prime Minister Justin Trudeau offers well wishes to President Donald Trump and First Lady Melania Trump; Ontario surpasses 3,000 COVID-19 related deaths"
"92",2020-10-10,2020,"Have eased border restrictions allowed you to reunite with loved ones? Thank this couple"
"93",2020-10-10,2020,"What’s open, what’s closed and how you can celebrate Thanksgiving in Toronto during COVID-19"
"94",2020-10-10,2020,"Remembrance Day planners scrambling as COVID-19 upends traditional ceremonies"
"95",2020-10-11,2020,"This doctor has a deadly cancer — the same one that killed his brother. A Toronto hospital is combining MRI to radiation in a new way to attack it"
"96",2020-10-11,2020,"Susan Delacourt: Politicians should take some time to be thankful this weekend. Their jobs are about to get a lot tougher"
"97",2020-10-11,2020,"Canadian woman reunites with British fiancé as COVID-19 border woes keep them apart, even as she is diagnosed with cancer"
"99",2020-10-11,2020,"Today’s coronavirus news: Canadians from coast to coast asked to limit size of Thanksgiving gatherings; India’s confirmed coronavirus toll crosses 7 million"
"100",2020-10-11,2020,"Millions of Canadians will qualify for a tax refund this year because they were working from home — here’s how to apply"
"101",2020-10-11,2020,"Ontario small businesses race to adapt to COVID-19 restrictions — again: ‘It’s a hard pill to swallow’"
"102",2020-10-11,2020,"Leafs trade Andreas Johnsson, add defenceman Zach Bogosian as remake continues"
"103",2020-10-11,2020,"The Competition Bureau’s investigation of Amazon is long overdue — and the online retailer is still growing at a blistering pace"
"104",2020-10-12,2020,"RCMP union pushes back against ban on ‘thin blue line’ symbol, says it has ordered custom patches"
"105",2020-10-12,2020,"I tested positive for COVID-19 antibodies after seven months. Here’s what that means"
"106",2020-10-12,2020,"He went to prison for a child’s murder 37 years ago. An unprecedented appeal to clear his name begins this week"
"107",2020-10-12,2020,"We can’t eliminate COVID risk in schools. But can we solve the runny-nose riddle for screening symptomatic students?"
"108",2020-10-12,2020,"Today’s coronavirus news: Quebec sees 843 new COVID-19 cases; China to test nine million people in one city this week; U.K. announces new restrictions as virus cases rise"
"109",2020-10-12,2020,"Public health won’t tell us which employers have COVID-19 outbreaks. But we obtained WSIB data to help paint a picture"
"111",2020-10-12,2020,"14 of the week’s best long reads from the Star, Oct. 3 to 9, 2020"
"113",2020-10-13,2020,"‘A crazy system’: U.S. voters face huge lines and gerrymandering. How Elections Canada makes a world of difference north of the border"
"114",2020-10-13,2020,"Canadian businessman, Toronto real estate firm implicated in multi-million-dollar offshore tax scheme in Channel Islands"
"115",2020-10-13,2020,"This 23-year-old recent grad is unemployed and job searching amid COVID-19. He lives at home, has no debt but wants to move out. How can he start?"
"116",2020-10-13,2020,"Three schools closed, one reopens as Ontario reports 72 more COVID-19 cases in schools"
"117",2020-10-13,2020,"Today’s coronavirus news: Ontario reporting more than 1500 new COVID-19 cases in 2 days; Soccer star Ronaldo tests positive; Ontario deciding which care homes to get Red Cross support"
"118",2020-10-13,2020,"‘It’s weird to say ‘you can’t see your nanny and granddad for Thanksgiving, but we’re adding several more kids to your class’"
"119",2020-10-13,2020,"O’Toole to resume in-person fundraising events after COVID-19 recovery"
"120",2020-10-13,2020,"Supreme Court nominee Barrett says she can set aside Catholic beliefs in second day of confirmation hearings"
"121",2020-10-14,2020,"Facing backlash over ‘insensitive’ advice, TTC says it’s always been clear social distancing will be impossible"
"122",2020-10-14,2020,"Shree Paradkar: U of T orders independent review of human rights program hiring fiasco"
"123",2020-10-14,2020,"Mi’kmaq chief slams Nova Scotia fishery violence: ‘They are getting away with these terrorist, hate crime acts’"
"124",2020-10-14,2020,"He owed millions in taxes. Instead of paying up, he enlisted an offshore company to bankrupt his business and cheat the CRA"
"125",2020-10-14,2020,"Second wave for some, tsunami for others. Medical experts on why the Ontario government’s one-size-fits-all approach doesn’t work"
"126",2020-10-14,2020,"Canada’s top doctor has been reluctant to say tiny airborne particles spread COVID-19. Under pressure, she’s reconsidering"
"127",2020-10-14,2020,"What you need to know about COVID-19 antibodies from someone who has them"
"128",2020-10-14,2020,"Barrett back on Capitol Hill for third and final day of senators’ questions"
"129",2020-10-14,2020,"Today’s coronavirus news: Ontario reporting 721 cases of COVID-19; WestJet cutting flights to Atlantic Canada, laying off staff; Health Canada adds 5 products to list of recalled hand sanitizers"
"130",2020-10-14,2020,"School-related COVID-19 cases jump by 96 on Wednesday, a total of 1,040 since classrooms reopened; five schools closed to contain spread"
"131",2020-10-14,2020,"Hospitalizations, long-term-care infections increasing: Three charts show state of COVID-19 in Ontario as Toronto, Peel, Ottawa re-enter Stage 2"
"132",2020-10-15,2020,"Province to scrap controversial teacher hiring rule"
"133",2020-10-15,2020,"Warning from a pandemic data dump? Ottawa sewage shows ‘alarming’ spike in COVID-19 virus"
"134",2020-10-15,2020,"There are lots of obstacles to voting in America. This year, apathy won’t be one of them"
"135",2020-10-15,2020,"Today’s coronavirus news: Domestic abuse calls to Canadian helplines jump during pandemic; Millions in England likely to move to tighter restrictions; India reports fewest deaths in 11 weeks"
"136",2020-10-15,2020,"A glitch in the system meant the switch from CERB to EI wasn’t seamless for everyone"
"137",2020-10-15,2020,"Toronto charts a course out of the COVID-19 pandemic with a recovery ‘roadmap’ — but without new powers or new money"
"139",2020-10-15,2020,"‘The RCMP just stood there’: Attack on Mi’kmaq fishery sparks tense standoff, condemnation"
"140",2020-10-15,2020,"Thailand declares emergency after unprecedented protest"
"142",2020-10-16,2020,"Joe Biden versus Donald Trump: A tale of two tweeters"
"143",2020-10-16,2020,"It’s April all over again. A look at the numbers shows Ontario could be on the brink of another long-term-care catastrophe"
"144",2020-10-16,2020,"Premier Doug Ford’s government fundraising off of their ‘support for small businesses’ days after forced COVID-19 closures"
"145",2020-10-16,2020,"How DNA and a genealogy website helped lead to the killer of Christine Jessop"
"146",2020-10-16,2020,"Christine Jessop’s brother explains his theory about her abduction after police identify the killer in her 1984 murder"
"147",2020-10-16,2020,"Trump, Biden debate was just a click away"
"148",2020-10-16,2020,"Today’s coronavirus news: Ontario reporting 712 cases of COVID-19, 9 new deaths; Ontario fitness industry awaits outcome of review; Germany sees 7,000 new infections for the first time"
"149",2020-10-16,2020,"TTC planning to order more streetcars from Bombardier"
"150",2020-10-16,2020,"The day DeMar DeRozan shared his deepest fears one-on-one — and started a wave of hope"
"151",2020-10-16,2020,"Gregor Chisholm: The Blue Jays shouldn’t give Vlad Guerrero another shot at third base. Versatility isn’t for everyone. It’s first or bust next season"
"152",2020-10-17,2020,"Police use of genetic data like that used to find Christine Jessop’s killer is cause for concern, privacy experts say"
"153",2020-10-17,2020,"Fire destroys lobster pound in Nova Scotia, police say man in hospital with injuries"
"154",2020-10-17,2020,"Today’s coronavirus news: Ontario has 805 new cases of the coronavirus; Quebec with 1,279 new COVID-19 cases; Public Health survey shows satisfaction with response to the pandemic"
"155",2020-10-17,2020,"It’s a burning question that calls out to be answered: Could Christine Jessop’s killer have more victims?"
"156",2020-10-17,2020,"Was it him who cried out, ‘please God, help me’? Christine Jessop’s mother on the questions that come after learning who killed her daughter"
"157",2020-10-18,2020,"Prescription for ‘remarkable chaos’? Doctors question costs and details of Ontario’s move to asymptomatic COVID testing in pharmacies"
"158",2020-10-18,2020,"Should Canada buy this American community? Cut off by COVID-19, some in Point Roberts say it’s time for a change"
"159",2020-10-18,2020,"‘It gets me really mad’: Bracing for more sickness and death, Americans aren’t buying Donald Trump’s message on COVID-19"
"160",2020-10-18,2020,"Lowest of the social media low, LeBron's legacy and figuring out salaries in the mail"
"161",2020-10-18,2020,"Two Toronto hospitals declare COVID-19 outbreaks"
"162",2020-10-18,2020,"Today’s coronavirus news: Ontario has 658 new cases of COVID-19 and five new deaths; Those numbers are down from the 805 new cases and 10 deaths on Saturday"
"163",2020-10-18,2020,"Girls who went missing in Ontario: Solved and unsolved cases"
"164",2020-10-18,2020,"Pushed from power, B.C. Green Leader Sonia Furstenau is ready to talk minority government"
"165",2020-10-18,2020,"Are B.C.’s pandemic-battered voters ready to return the NDP’s John Horgan to power?"
"166",2020-10-18,2020,"Q&A: Brian Burke still roots for the Maple Leafs and defends the Kessel trade ... but wishes they’d played hardball with Nylander"
"167",2020-10-18,2020,"There’s racism in the stands when Toronto FC plays at BMO Field. Concerned fans and the club are working to change that"
"168",2020-10-19,2020,"Ontario’s chief medical officer gets pushback after warning against trick-or-treating in COVID hotspots"
"169",2020-10-19,2020,"COVID-19 is ‘accelerating’ the pace of delivering digital government services"
"170",2020-10-19,2020,"Twenty-five years after ‘welfare diet’ debacle, social assistance still hasn’t recovered from Mike Harris cuts"
"171",2020-10-19,2020,"Majority of gun fatalities in Ontario are suicides by older men in rural areas, new study finds"
"172",2020-10-19,2020,"Trump goes after Fauci, tries to buck up his campaign team"
"173",2020-10-19,2020,"This 23-year-old makes $68,000 working in pharmaceuticals. He has $34,000 in student debt that’s expected to double as he pursues his masters. How can he save up to buy his own condo?"
"174",2020-10-19,2020,"Today’s coronavirus news: Door-to-door Halloween trick-or-treating is not recommended in Toronto, Peel, York and Ottawa; Ontario reporting 704 new cases, 4 deaths; Border closure extended to Nov. 21"
"175",2020-10-19,2020,"Workers shocked to learn government aid for working freelance, self-employed is more generous than for employees"
"176",2020-10-19,2020,"Everything you wish you knew about the latest COVID-19 science"
"177",2020-10-19,2020,"10 per cent of Ontario public schools has a COVID-19 case with 74 more cases reported"
"178",2020-10-20,2020,"‘It’s an ongoing battle in here’: COVID-19 has halted building-wide spraying for bedbugs in Toronto’s community housing. Tenants feel helpless"
"179",2020-10-20,2020,"‘The next I know the front of my shirt was red’: Young sisters describe horror of being shot in a Toronto playground"
"180",2020-10-20,2020,"Sipekne’katik fishers push on amid politicians’ debate and RCMP checkpoints: ‘I’m here to provide for my sons and daughters’"
"181",2020-10-20,2020,"University of Ottawa professors just can’t stop using the N-word. Student and faculty outrage is boiling over"
"182",2020-10-20,2020,"Liberals say Tory effort to set up COVID-19 committee will be a confidence matter"
"183",2020-10-20,2020,"Ottawa cop found not guilty in death of Somali Canadian man"
"184",2020-10-20,2020,"Democracy and a deadly virus: How two Toronto byelection campaigns are playing out during COVID-19’s second wave"
"185",2020-10-20,2020,"Today’s coronavirus news: Ontario reporting 821 cases, 3 more deaths; 1 in 4 Canadians say mental health is worse now"
"186",2020-10-21,2020,"Chances of snap election dim after NDP and Greens signal they will not vote to defeat the government"
"187",2020-10-21,2020,"Premier Doug Ford’s government will unveil a pandemic budget within two weeks"
"188",2020-10-21,2020,"EU shuts door to travel from Canada, lets in Singapore visitors"
"189",2020-10-21,2020,"Immigration and Refugee Board rules against Helmut Oberlander"
"190",2020-10-21,2020,"Too many lawsuits from families who lost loved ones to COVID-19 in nursing homes would ‘gum up’ the legal system, Ontario Attorney General Doug Downey says"
"191",2020-10-21,2020,"Parents of 545 children that the Trump administration separated at U.S.-Mexico border can’t be found"
"192",2020-10-21,2020,"Today’s coronavirus news: De Villa says 21 more people hospitalized in Toronto, totalling 128; EU removes Canada from list of approved visitors"
"193",2020-10-21,2020,"Plexiglas, masks and the same old crummy compensation: What it’s like to serve on an Ontario jury in a pandemic"
"194",2020-10-22,2020,"‘No escape.’ With COVID-19 in the shadows, why seasonal depression could be worse than ever this year"
"195",2020-10-22,2020,"Donald Trump arrives at his final debate trailing badly and swinging wildly"
"196",2020-10-22,2020,"Canadian media outlets challenge the government to save the industry with new measures to rein in big tech"
"197",2020-10-22,2020,"Hillside collapse at Eglinton Crosstown LRT construction site leaves neighbours worried about their homes"
"198",2020-10-22,2020,"Canadian Forces investigates after mystery man in secret recording claims to be a soldier — and a neo-Nazi"
"199",2020-10-22,2020,"Who won the fight that almost toppled Justin Trudeau’s government? Depends who you ask"
"200",2020-10-22,2020,"Today’s coronavirus news: Ontario reporting 841 cases of COVID-19, 9 deaths; Tories launch another motion calling for review of Liberals’ handling of pandemic; Outbreak declared at Scarborough hospita"
"201",2020-10-22,2020,"COVID-19 had a devastating effect on the quality of life of nursing home residents. We may never know how much because some homes hit pause on assessing it"
"202",2020-10-23,2020,"Toronto police getting dozens of tips about Calvin Hoover, the dead man tied to Christine Jessop’s murder by DNA"
