"","date","year","headline"
"405",2021-10-11,2021,"On a diet? Here's how to navigate this year’s Thanksgiving feast"
"406",2021-10-12,2021,"Maj.-Gen. Dany Fortin loses court bid to be reinstated as head of Canada’s vaccine rollout"
"407",2021-10-12,2021,"Attempts at building a cycling network in Scarborough have been an ‘abject failure,’ harming residents’ health. A new report shows how that can be fixed"
"408",2021-10-12,2021,"The TTC is eyeing bringing employees out of retirement in case the vaccine mandate deadline causes a labour shortage"
"409",2021-10-12,2021,"‘We are flying blind’: With hundreds of COVID-19 cases in Ontario schools, why numbers alone don’t tell the whole story"
"410",2021-10-12,2021,"Frederik Andersen, Nazem Kadri, Lou’s Islanders — Leafs games you won’t want to miss"
"411",2021-10-12,2021,"‘Johnny’s our leader.’ How Leafs captain John Tavares rallied the troops after a playoff letdown, and made peace with not being the star"
"412",2021-10-12,2021,"Here's a look at the stunning northern lights spotted across Canada on Monday"
"413",2021-10-12,2021,"Toronto Public Health shuts down entire high school for the first time this school year over COVID-19 outbreak"
"414",2021-10-12,2021,"Today’s coronavirus news: Ontario reporting 848 COVID-19 cases over the past two days; Rising numbers prompt N.B. hospitals to move to red alert"
"415",2021-10-12,2021,"Interesting finds for Tragically Hip fans in ‘Road Apples 30th Anniversary’ release"
"416",2021-10-12,2021,"A treat for Halloween: After a dud year in 2020, manufacturers say candy is already flying off the shelves"
"417",2021-10-13,2021,"Why are stadiums returning to full capacity when restaurants are still restricted? One expert calls it ‘anti-science’"
"418",2021-10-13,2021,"Here’s what you need to know about crossing the U.S.-Canada land border next month"
"419",2021-10-13,2021,"More than 180,000 workers have left the restaurant sector. Most have become white-collar workers — and they’re not coming back"
"420",2021-10-13,2021,"A patchwork of penalties means some Toronto public servants face strict rules about vaccination — and some face none at all"
"421",2021-10-13,2021,"Today’s coronavirus news: Ontario reporting 306 cases of COVID-19; Quebec delays vaccine mandate for health workers until Nov. 15"
"422",2021-10-13,2021,"This Syrian IT worker was stuck in limbo in Lebanon. Now he works at Shopify — thanks to a Canadian pilot program for skilled refugees"
"423",2021-10-13,2021,"Five key questions for the Maple Leafs. Yes, Auston Matthews is one of them"
"424",2021-10-13,2021,"Chris Johnston: Auston Matthews will miss the start of the NHL season but the Leafs’ star should be worth the wait"
"425",2021-10-13,2021,"NHL insiders talk Toronto Maple Leafs and new season"
"426",2021-10-13,2021,"William Shatner, TV’s Capt. Kirk, blasts into space"
"427",2021-10-13,2021,"Two dead and four injured after multi-vehicle crash near High Park"
"428",2021-10-13,2021,"Most Canadians believe Facebook harms their mental health: survey"
"429",2021-10-14,2021,"Have mixed doses, won’t travel? Canadians who got two different COVID jabs worry U.S. border rules could exclude them"
"430",2021-10-14,2021,"Premier Doug Ford wants Ottawa to clamp down on exemptions for unvaccinated travellers"
"431",2021-10-14,2021,"Canada’s vaccine passport for travellers expected ‘within weeks’"
"432",2021-10-14,2021,"Ontario LTCs brought in entry-level assistants during the pandemic. Will they play a role in nursing homes’ future?"
"433",2021-10-14,2021,"How social media reacted after Alphonso Davies lifted the Canadian men’s national team to victory"
"434",2021-10-14,2021,"This fully-furnished Toronto unit is available for $1,720 a month, utilities included. Why hasn’t it been rented out?"
"435",2021-10-14,2021,"Doug Ford expected to lift COVID-19 capacity restrictions for restaurants, bars and gyms as part of ‘pandemic plan 2.0’"
"436",2021-10-14,2021,"Today’s coronavirus news: Ontario expected to unveil plan to further reopen economy; Border towns prepare for reopening of Canada-U.S. border"
"437",2021-10-14,2021,"Canadians will soon be able to drive across the U.S. border again. Here’s why that might be a bad idea"
"438",2021-10-14,2021,"Canadian Army commander’s appointment stalled by military police investigation"
"439",2021-10-14,2021,"Overnight building blaze in Taiwan raged for hours, 46 dead"
"440",2021-10-14,2021,"Norway officials: Bow-and-arrow attack appears act of terror"
"441",2021-10-15,2021,"Here’s how to download Ontario’s new enhanced COVID-19 vaccine passport QR code"
"442",2021-10-15,2021,"Ontarians can begin downloading new enhanced vaccine passport Friday"
"443",2021-10-15,2021,"Barry Sherman’s Apotex has paid $100 million to answer U.S. price-fixing allegations and agreed to help investigate competitors"
"444",2021-10-15,2021,"Trouble sleeping? Landmark study links mental illness with restless nights"
"445",2021-10-15,2021,"‘We just want the kids to have fun’: Parents navigate pitfalls of planning children’s pandemic social lives"
"446",2021-10-15,2021,"Today’s coronavirus news: Ontario reporting 496 new cases of COVID-19; White House says U.S. land borders to reopen to vaccinated travellers Nov. 8;"
"447",2021-10-15,2021,"Prime Minister Justin Trudeau to name new cabinet Oct. 26, with Parliament set to return Nov. 22"
"448",2021-10-15,2021,"Former St. Michael’s College School student found guilty of sex assault set to be sentenced Friday"
"449",2021-10-15,2021,"Bring back the commute and office attire. A growing sense of isolation and lack of belonging shifting feelings on remote work"
"450",2021-10-15,2021,"Should transplant recipients require COVID vaccines? One Toronto hospital network says yes"
"451",2021-10-15,2021,"Royal LePage forecasts 16-per-cent bump in home prices, despite IMF warnings of global market crashes"
"452",2021-10-16,2021,"Small business advocates are angry MLSE helped Ontario develop its vaccine passport app, but the company says it didn’t get special treatment"
"453",2021-10-16,2021,"Biggest Ontario universities are seeing high vaccine coverage ahead of immunization deadlines"
"454",2021-10-16,2021,"Chrystia Freeland has a different set of problems in post-Trump America"
"455",2021-10-16,2021,"‘They’re gagging people’: New Brunswick orders halt to Indigenous land acknowledgments — and faces a national backlash"
"456",2021-10-16,2021,"Martin Regg Cohn: Here’s why Doug Ford won’t congratulate the Ontario-born winner of the Nobel Prize for economics"
"457",2021-10-16,2021,"The Saturday Debate: Is there a need for the Green Party?"
"458",2021-10-16,2021,"‘Rexdale is him.’ Raptors rookie Dalano Banton inspiring the neighbourhood he grew up in"
"460",2021-10-16,2021,"Today’s coronavirus news: Ontario reports 486 new cases; New Zealand administers record number of jabs at ‘Vaxathon’; Russia’s daily death toll soars above 1,000"
"461",2021-10-17,2021,"Minister in Doug Ford’s government accused of using controversial new law to try to ‘silence’ grassroots groups"
"462",2021-10-17,2021,"OLG audit finds misuse of corporate credit cards, 46 per cent raises, and no comprehensive business case for modernization plans"
"463",2021-10-17,2021,"The science is clear: pregnant Ontarians should get the COVID vaccine. Why are so many rejecting it?"
"464",2021-10-17,2021,"As Indo-Pacific strategies move forward, little known about Canada’s plans"
"465",2021-10-17,2021,"As Alberta holds a referendum, we asked: What would Canada look like without equalization?"
"466",2021-10-17,2021,"Jason Kenney promised Albertans a referendum. It turns out the premier may be the real ballot-box issue"
"467",2021-10-17,2021,"Kingston police declare homecoming gathering ‘aggravated nuisance’"
"468",2021-10-17,2021,"Why Canada’s first big-city Muslim mayor, Naheed Nenshi, is leaving politics — for now"
"469",2021-10-17,2021,"Conservative Christians are obsessed with homosexuality. Strangely, Jesus never explicitly mentioned it"
"470",2021-10-17,2021,"‘It was pretty wicked.’ U of T goalie Alex Bishop has a night to remember as a Leaf"
"471",2021-10-17,2021,"Richmond Hill councillor must pay roughly $140,000 for recycling, compost bin giveaway, council rules"
"472",2021-10-17,2021,"Today’s coronavirus news: Ontario reports 443 new cases;Worrying number of pregnant individuals remain unvaccinated; 90% of military personnel fully vaccinated"
"473",2021-10-17,2021,"Nuit Regular, one of Toronto’s most widely recognized chefs, has changed the way people think about Thai food"
"474",2021-10-17,2021,"The story behind the martial arts method known as Defendo"
"475",2021-10-17,2021,"The Parkdale Haunt — one of the world’s most popular horror-fiction podcasts produced right here in Toronto"
"476",2021-10-18,2021,"Premier Doug Ford signals strong support for controversial Highway 413"
"477",2021-10-18,2021,"Ontario labour minister says new temp agency laws will end working conditions he describes as akin to ‘modern-day slavery’"
"478",2021-10-18,2021,"Here’s what experts say needs to happen to ensure Ontario stays on the right path in easing COVID restrictions"
"479",2021-10-18,2021,"Toronto Catholic school board says unvaccinated staff not doing rapid testing will be barred"
"480",2021-10-18,2021,"Colin Powell, exemplary general stained by Iraq claims, dies"
"481",2021-10-18,2021,"Canada won’t stop Crown corporations from investing in fossil fuels any time soon. Here’s why"
"482",2021-10-18,2021,"Will the U.S. accept mixed vaccinations? What about my kids under 12 who can’t get vaccinated? Answering your questions on U.S. border travel"
"483",2021-10-18,2021,"Why spending time on Facebook and Instagram is bad for your mental state — and your finances"
"484",2021-10-18,2021,"Today’s coronavirus news: Ontario is reporting 373 COVID-19 cases; All vaccinated Ontarians can now download enhanced, scannable certificates"
"485",2021-10-18,2021,"2 Ontario doctors barred from issuing medical exemptions for COVID vax, masks, tests"
"487",2021-10-18,2021,"What today’s referendum really means for Alberta — and for Jason Kenney"
"488",2021-10-19,2021,"When Toronto needed nurses, they raised their hands. With Alberta in COVID crisis, these Newfoundlanders have done it again"
"489",2021-10-19,2021,"Justin Trudeau visits Tk’emlúps te Secwe̓pemc, is rebuked for ill-timed Tofino vacation"
"490",2021-10-19,2021,"Alberta mayoral elections: Jyoti Gondek wins in Calgary, Amarjeet Sohi wins in Edmonton"
"491",2021-10-19,2021,"Pfizer officially submits application for COVID vaccine for kids aged 5-11 to Health Canada"
"492",2021-10-19,2021,"NHL suspends Evander Kane 21 games for submitting a fake COVID vaccination card"
"493",2021-10-19,2021,"Auston Matthews makes an immediate impact in Leafs return — but OT miss hurts. ‘I’d like to have that one back’"
"494",2021-10-19,2021,"Ontario’s vaccine passport app is here — but experts say the new system does nothing to prevent fraud"
"496",2021-10-19,2021,"Today’s coronavirus news: Ontario reporting 328 new cases of COVID-19; Outbreaks identified after weddings at 2 Mississauga banquet halls"
"497",2021-10-19,2021,"‘He’s not a pit bull’: GTA dog owner fights DNA test that could see puppy deported out of province"
"498",2021-10-19,2021,"Two Ontario doctors ordered to stop issuing exemptions for COVID-19 vaccinations"
"499",2021-10-19,2021,"Colin Powell knew that history would judge him harshly"
"500",2021-10-20,2021,"What’s next for Quayside? The resumes of the four teams vying to reimagine Toronto’s waterfront might offer a hint"
"501",2021-10-20,2021,"‘Alarmingly invasive:’ This Ontario mayor may have his pay docked after asking a woman online if her COVID-19 vaccine changed her menstruation"
"502",2021-10-20,2021,"Toronto homicide detective stole drugs from evidence lockers as many as 20 times"
"503",2021-10-20,2021,"Premier Doug Ford’s Tory government to table mini-budget on Nov. 4"
"504",2021-10-20,2021,"Dave Feschuk: The Raptors aren’t NBA title contenders but they have a chance to be likeable overachievers"
"505",2021-10-20,2021,"The Raptors have constructed a roster unlike any other in franchise history. A place in the NBA playoffs is on the line"
"506",2021-10-20,2021,"Ontario law will guarantee washroom access to delivery workers"
"507",2021-10-20,2021,"Today’s coronavirus news: Ontario reporting 304 cases of COVID-19; White House details plans to vaccinate 28M children age 5-11"
"508",2021-10-20,2021,"Queen accepts medical advice to rest, cancels Northern Ireland trip"
"509",2021-10-20,2021,"MPs will need to be fully vaccinated against COVID-19 to go back into the House of Commons"
"510",2021-10-20,2021,"Doug Ford doubles down on comments about ‘hard working’ new Canadians"
"511",2021-10-20,2021,"Negotiations drag on over 17 missionaries kidnapped in Haiti"
"512",2021-10-21,2021,"These ‘first of their kind’ Ontario changes could get more skilled immigrants working in their actual fields of expertise"
"513",2021-10-21,2021,"We asked 31 major Ontario school boards for their staff COVID-19 vaccination rates. Here’s what we found"
"514",2021-10-21,2021,"The CRB is on its way out, as a suite of pandemic benefits are set to expire"
"515",2021-10-21,2021,"Doug Ford refuses to apologize for comment about immigrants"
"516",2021-10-21,2021,"Conservatives protest ‘meeting in secret’ to make COVID-19 vaccinations mandatory in Parliament"
"517",2021-10-21,2021,"NDP will vote against the Liberals ‘if they do something that hurts Canadians,’ Jagmeet Singh says"
"518",2021-10-21,2021,"TDSB replaces elementary school guidance counsellors with newly defined role amid opposition from teachers’ union"
"519",2021-10-21,2021,"Today’s coronavirus news: India hits 1 billion vaccine doses; Canada Recovery Benefit set to expire"
"520",2021-10-21,2021,"The lessons begin for Scottie Barnes and the Raptors in season-opening loss to the Wizards"
"521",2021-10-21,2021,"Dancers say they were sexually harassed or groomed by famous choreographers – and the dance company failed to protect them"
"522",2021-10-21,2021,"Trudeau urged to make decriminalization of illicit drugs a priority"
"523",2021-10-21,2021,"Over 180 people killed after heavy rains in Nepal and India"
"524",2021-10-22,2021,"‘Jobs at risk’: Experts fear wave of layoffs, business closures following end of federal wage and rent subsidy programs"
"525",2021-10-22,2021,"Edward Rogers strikes back with plan to replace board members"
"526",2021-10-22,2021,"‘I’ve seen a lot of injustice.’ Former NHLer Bernie Saunders turns the page with ‘Shut Out’ on life as a Black hockey player"
"527",2021-10-22,2021,"U of T received formal complaints against ex-Trinity College provost accused of sexual harassment, but he wasn’t punished"
"528",2021-10-22,2021,"How the supply chain broke, and why it won’t be fixed anytime soon"
"529",2021-10-22,2021,"Ontario will ease COVID-19 restrictions on restaurants and gyms starting Monday"
"530",2021-10-22,2021,"Dancers say they were sexually harassed or groomed by famous choreographers — and the dance company failed to protect them"
"531",2021-10-22,2021,"Keep COVID-19 mask rules and vaccine passports, Ontario science table tells Doug Ford"
"532",2021-10-22,2021,"This detached home listed under $800,000 is considered one of the cheapest in Toronto right now. Why is that?"
"533",2021-10-22,2021,"Today’s coronavirus news: Ontario reporting 492 COVID-19 cases; Ontario can control COVID-19 with continued health measures, science table says"
"534",2021-10-22,2021,"Green Party to drop legal action against Annamie Paul as discussions drag on"
"535",2021-10-22,2021,"Alec Baldwin fatally shoots crew member with prop firearm on film set, authorities say"
"536",2021-10-22,2021,"A massive wave of workers will soon be fired for refusing to get vaccinated — this food services manager is one of the first"
"537",2021-10-23,2021,"This investor owns 17 homes. He and other multiple-property owners are now the largest slice of Toronto homebuyers"
"538",2021-10-23,2021,"A Black man, a fatal police shooting, and a widow who didn’t back down: The 1979 case that electrified the city and launched a movement"
"539",2021-10-23,2021,"Canada’s food inflation figures are wrong, critics say — mainly because just three grocers supply the data"
"540",2021-10-23,2021,"Wilder than ever: why a pandemic backlash and social media are fuelling mayhem at Canada’s universities"
"541",2021-10-23,2021,"He won’t resign, despite revelations he once inappropriately touched a teenager. Is Calgary stuck with this councillor?"
"542",2021-10-23,2021,"Doug Ford slams former PC MPP for ‘disgusting’ false claims about COVID-19 vaccinations"
"543",2021-10-23,2021,"Here’s how to download Canada’s international travel vaccine passport"
"544",2021-10-23,2021,"Susan Delacourt: How did the election change Justin Trudeau? We’ll know when we see his cabinet"
"545",2021-10-23,2021,"They believe COVID is real and that vaccines work. They’re fighting vaccine passports in court anyway"
"546",2021-10-23,2021,"Today’s coronavirus news: Ontario reports 373 new cases of COVID-19; Russia, once again, reports record infections and deaths"
"548",2021-10-23,2021,"Travis Wall taken off tour with Break the Floor dance company following Star investigation"
"549",2021-10-23,2021,"Alec Baldwin was told gun in fatal shooting on set was safe, officials say"
"550",2021-10-24,2021,"The man who won’t be mayor: Why one of Toronto’s youngest and most effective political leaders is calling it quits"
"551",2021-10-24,2021,"This Canadian mom has spoken out about her daughter’s death for years. A new publication ban means the story can no longer be shared"
"552",2021-10-24,2021,"‘In our culture, water is so much more. It’s sacred.’ New wave of Indigenous operators look to tackle drinking-water woes"
"553",2021-10-24,2021,"COP26: Canada talks a good game on fighting climate change. The reality is less impressive"
"554",2021-10-24,2021,"The story behind a 1973 photo of a young couple gathering autumn leaves. Spoiler alert: they’re still going strong"
"555",2021-10-24,2021,"Why it took college friends Kim Jose and Ian Surage more than a decade to walk down the aisle"
"556",2021-10-24,2021,"This midtown garden amid the construction chaos blooms a lush oasis of flowers, fountains and quirky artwork. Brian Gorrell tells us what drove him to create it"
"557",2021-10-24,2021,"Mayor John Tory’s decision: Will he stay or will he go now?"
"558",2021-10-24,2021,"Chantal Hébert: Erin O’Toole is chasing Jason Kenney and Doug Ford in a race to the bottom"
"559",2021-10-24,2021,"Today’s coronavirus news: Ontario reports 370 new cases of COVID-19, 1 death; Parents more hesitant to vaccinate kids than themselves, researcher says"
"560",2021-10-25,2021,"Edward Rogers fought plans to keep Raptors’ Masai Ujiri, but was thwarted by MLSE head, sources say"
"561",2021-10-25,2021,"Board assembled by Edward Rogers announces he is chair of Rogers — again — but family members deny legitimacy"
"562",2021-10-25,2021,"Elections Ontario asked to divulge MPP complaints that could muzzle community groups"
"563",2021-10-25,2021,"Buried in after-hours emails? Ontario to propose ‘right-to-disconnect’ laws"
"564",2021-10-25,2021,"Today’s coronavirus news: Ontario reporting 326 new COVID-19 cases; Ontario and B.C. lifting capacity limits as cases ease"
"565",2021-10-25,2021,"Ontario school board staff claiming medical exemptions for COVID-19 vaccines at far higher rate than expected"
"566",2021-10-25,2021,"City of Toronto and Toronto police being sued over Lamport Stadium encampment clearing"
"567",2021-10-25,2021,"A new online encyclopedia will be a hub of Indigenous teachings"
"568",2021-10-25,2021,"Here’s how desperate Canadian provinces are trying to lure nurses — and what those in the field say they’re getting wrong"
"569",2021-10-25,2021,"The TSX keeps climbing higher. How long can this last?"
"570",2021-10-25,2021,"At 35, this Toronto set designer makes $110,000. She just found out she’s pregnant. How can she prepare financially?"
"571",2021-10-26,2021,"Prime Minister Justin Trudeau unveils new federal cabinet, promoting Guilbeault and shuffling out Garneau"
"572",2021-10-26,2021,"New defence minister Anita Anand will have to rebuild trust in military rocked by sexual misconduct crisis, observers say"
"573",2021-10-26,2021,"Canada has a big-time nursing shortage. So why can’t these two fully certified nurses get the OK to practise?"
"574",2021-10-26,2021,"John Tory suffered a rare loss at Toronto council over legalizing rooming houses. An inside look at a move that baffled and outraged housing critics"
"575",2021-10-26,2021,"This Ontario man died without a will. A Toronto police officer is charged with stealing his $800,000 estate"
"576",2021-10-26,2021,"‘We’re giving North Koreans hope and a home.’ Pilot program gives escapees from Pyongyang a pathway to resettle in Canada"
"577",2021-10-26,2021,"Who will win the battle to control Rogers? Experts say Edward has the upper hand"
"578",2021-10-26,2021,"What’s going on at Rogers? Everything you need to know about the battle for control of Canada’s telecom behemoth"
"579",2021-10-26,2021,"Toronto’s hotel industry has been gutted by the pandemic. Can it bounce back?"
"580",2021-10-26,2021,"Insiders say Erin O’Toole has no easy way out as Conservatives prepare to meet amid battle over COVID-19 vaccinations"
"581",2021-10-26,2021,"Today’s coronavirus news: Ontario reporting 269 new COVID-19 cases; Ontario hiring 200 more nursing home inspectors"
"582",2021-10-27,2021,"Isolated. Desperate. Trapped: The pandemic upended these migrants’ lives. A new project shines light on their resilience"
"583",2021-10-27,2021,"John Tory’s ties to Rogers have been a source of conflict since he was elected mayor. Now they’ve dragged him into the middle of a bitter family feud"
"584",2021-10-27,2021,"Court filing reveals Rogers board accepted CEO’s resignation — but Loretta Rogers says she changed her mind because her son misled her"
"585",2021-10-27,2021,"Could space technology help us track the next pandemic?"
"586",2021-10-27,2021,"Doug Ford’s government should include TTC workers in its right-to-washroom bill, says transit union"
"587",2021-10-27,2021,"Ontario putting $100M into adding 2,000 more nurses in the next few years"
"588",2021-10-27,2021,"Prime Minister Justin Trudeau stakes out his political future with new cabinet"
"589",2021-10-27,2021,"The Winter Olympics are 100 days away, and Canada’s athletes are ready to ‘live out of a suitcase’ in pursuit of the podium"
"590",2021-10-27,2021,"Pope Francis agrees to visit Canada to help with Indigenous reconciliation, Vatican says"
"591",2021-10-27,2021,"Ontario lays first COVID-19 charges against long-term care home in London"
"592",2021-10-27,2021,"Bank of Canada warns on prolonged inflation, ends bond-buying program"
"593",2021-10-27,2021,"Toronto wants up to 22 per cent of new condos to be affordable. Is it leaving homes on the table?"
"594",2021-10-27,2021,"Today’s coronavirus news: Ontario reporting 321 new COVID-19 cases, 10 deaths; TDSB extends deadline for staff vaccination policy"
"595",2021-10-28,2021,"Former Conservative MP sues provincial Tories over failed nomination bid"
"596",2021-10-28,2021,"Ford government pledged $2.5 million to Facedrive for bracelets to fight COVID — but employees say the tech ‘never worked like it should.’ How were so many alarms missed?"
"597",2021-10-28,2021,"Toronto’s first ever car condo is coming to the city and some housing experts are calling it ‘disrespectful’"
"598",2021-10-28,2021,"If Pope Francis is coming to Canada, here’s what Indigenous leaders say he must do"
"599",2021-10-28,2021,"‘Unconscionable’: Here are the cabinet contenders Justin Trudeau snubbed"
"600",2021-10-28,2021,"The inside story of how Edward Rogers’s plan to oust Joe Natale went off the rails"
"601",2021-10-28,2021,"‘I am a survivor’: Kyle Beach comes forward as ‘John Doe’ in Chicago Blackhawks sexual abuse scandal"
"602",2021-10-28,2021,"COVID-19 sweeps through Newmarket men's hockey league"
"603",2021-10-28,2021,"Today’s coronavirus news: Ontario reporting 409 new cases of COVID-19; Ontario legislature condemns Hillier’s COVID-19 posts"
"604",2021-10-28,2021,"Green Leader Annamie Paul still hasn’t officially resigned. Now her party is again trying to force her out"
"605",2021-10-28,2021,"Ontario reports 80 new cases of COVID in schools and 503 schools with confirmed cases"
"606",2021-10-28,2021,"Is there a mystery brain disease in New Brunswick? Health minister casts doubt on ‘validity’ — to surprise of families and lead doctor"
"607",2021-10-29,2021,"Nearly 70 per cent of Ontario parents of kids 5 to 11 planning to get them vaccinated, poll says"
"608",2021-10-29,2021,"A 109-container cargo spill is renewing First Nation calls to revolutionize how we deal with marine emergencies off Canada’s West Coast"
"609",2021-10-29,2021,"Choreographer Nick Lazzarini pulled from dance company tour following Star investigation"
"610",2021-10-29,2021,"Don Mills residents signed a deal for a new community centre more than a decade ago. Now the city and the developer are telling them to settle for less — or nothing at all"
"611",2021-10-29,2021,"Who is ‘essential’? Immigrants and foreign workers overrepresented in designated jobs during COVID-19, a new report finds"
"612",2021-10-29,2021,"Today’s coronavirus news: Managers shouldn’t decide if employee vaccine views are valid, federal unions say"
